{
  "cadence_id": "cadence-0001",
  "as_of_ts": "2026-03-04T16:10:00Z",
  "scope": {
    "scope_type": "area",
    "scope_ref": { "ref_type": "internal_id", "ref_id": "grid-18S-UJ-228-993" }
  },
  "policies": [
    {
      "policy_id": "p1",
      "applies_to": { "gap_type": "identity" },
      "target_refresh_interval_seconds": 7200,
      "max_staleness_seconds": 14400,
      "triggers": { "on_new_contradiction": true, "on_link_degraded": true },
      "degradation_action": "request_verification"
    },
    {
      "policy_id": "p2",
      "applies_to": { "gap_type": "legitimacy" },
      "target_refresh_interval_seconds": 21600,
      "max_staleness_seconds": 43200,
      "triggers": { "on_new_contradiction": true },
      "degradation_action": "downgrade_confidence"
    }
  ],
  "notes": "Cadence prioritizes identity gaps sooner than legitimacy indicators, but both degrade on contradictions."
}
